<?xml version="1.0" encoding="UTF-8"?>
<xs:schema xmlns:xs="http://www.w3.org/2001/XMLSchema" 
elementFormDefault="qualified">

<xs:element name="students">
   <xs:complexType>
     <xs:sequence>
      <xs:element name="student" maxOccurs="240" minOccurs="48">
       <xs:complexType>
        <xs:sequence>
          <xs:element name="CNE" type="xs:string"/>
          <xs:element name="LastName" type="xs:string"/>
          <xs:element name="FirstName" type="xs:string"/>
          <xs:element name="DateofBirth" type="xs:date"/>
          <xs:element name="Phone" type="xs:string"/>
          <xs:element name="Email" type="xs:string"/>
        </xs:sequence>
        </xs:complexType>
    </xs:element>
   </xs:sequence>
  </xs:complexType> 
  </xs:element>

  </xs:schema>  