<?xml version="1.0"?>
<students xmlns:xsi="http://www.w3.org/2001/XMLSchema-instance" xsi:noNamespaceSchemaLocation="C://xampp4/htdocs/Gestion_scolaire/fichiersDeValidation/students.xsd"><student>
    <CNE>18008561</CNE>
    <LastName>AGNAOU&#xA0;</LastName>
    <FirstName>MOHAMED</FirstName>
    <DateofBirth>18/10/1998</DateofBirth>
    <Phone>04 55 28 57 36</Phone>
    <Email>a.ultricies.adipiscing@sagittislobortismauris.com</Email>
  </student><student>
    <CNE>20007924</CNE>
    <LastName>AL ACHKAR&#xA0;</LastName>
    <FirstName>BADR</FirstName>
    <DateofBirth>28/11/1999</DateofBirth>
    <Phone>07 09 95 10 17</Phone>
    <Email>eget@elitpharetra.ca</Email>
  </student><student>
    <CNE>18002613</CNE>
    <LastName>AMARA&#xA0;</LastName>
    <FirstName>ASMAE</FirstName>
    <DateofBirth>29/04/2000</DateofBirth>
    <Phone>04 34 09 21 70</Phone>
    <Email>nonummy@sitamet.com</Email>
  </student><student>
    <CNE>18008851</CNE>
    <LastName>AOUAD&#xA0;</LastName>
    <FirstName>SAMI</FirstName>
    <DateofBirth>21/09/2001</DateofBirth>
    <Phone>04 55 59 07 00</Phone>
    <Email>diam.Sed.diam@dictummagna.net</Email>
  </student><student>
    <CNE>18008461</CNE>
    <LastName>BAHID&#xA0;</LastName>
    <FirstName>RIHAB</FirstName>
    <DateofBirth>31/03/2001</DateofBirth>
    <Phone>09 09 71 13 93</Phone>
    <Email>vel.convallis.in@tellus.edu</Email>
  </student><student>
    <CNE>18012385</CNE>
    <LastName>BARRO&#xA0;</LastName>
    <FirstName>CHEICKNA</FirstName>
    <DateofBirth>18/02/1999</DateofBirth>
    <Phone>04 03 74 96 33</Phone>
    <Email>eu.ligula@Nunc.org</Email>
  </student><student>
    <CNE>18008645</CNE>
    <LastName>BENKHANOUS&#xA0;</LastName>
    <FirstName>SALAHEDDINE</FirstName>
    <DateofBirth>28/04/2001</DateofBirth>
    <Phone>03 65 75 55 99</Phone>
    <Email>dapibus@dapibusgravidaAliquam.com</Email>
  </student><student>
    <CNE>18008723</CNE>
    <LastName>BENTALEB&#xA0;</LastName>
    <FirstName>CHAYMAE</FirstName>
    <DateofBirth>14/09/2000</DateofBirth>
    <Phone>01 13 17 82 27</Phone>
    <Email>In.at@lacusQuisquepurus.edu</Email>
  </student><student>
    <CNE>18008713</CNE>
    <LastName>BOUGUEDDACH&#xA0;</LastName>
    <FirstName>MOHAMED OUSSAMA</FirstName>
    <DateofBirth>31/07/2001</DateofBirth>
    <Phone>01 83 99 82 19</Phone>
    <Email>gravida.molestie.arcu@ac.edu</Email>
  </student><student>
    <CNE>18008663</CNE>
    <LastName>BOUHCAIN&#xA0;</LastName>
    <FirstName>ALI</FirstName>
    <DateofBirth>11/09/2000</DateofBirth>
    <Phone>06 17 06 13 51</Phone>
    <Email>blandit.enim@auctorvelit.com</Email>
  </student><student>
    <CNE>18008572</CNE>
    <LastName>BOUKHALLAD&#xA0;</LastName>
    <FirstName>AISSAME</FirstName>
    <DateofBirth>05/02/2001</DateofBirth>
    <Phone>06 16 17 67 88</Phone>
    <Email>ligula@convallisantelectus.ca</Email>
  </student><student>
    <CNE>17003887</CNE>
    <LastName>CHIHAL&#xA0;</LastName>
    <FirstName>AYA</FirstName>
    <DateofBirth>26/06/2001</DateofBirth>
    <Phone>04 64 98 60 55</Phone>
    <Email>est@laciniaatiaculis.edu</Email>
  </student><student>
    <CNE>18008535</CNE>
    <LastName>DABDOUBI&#xA0;</LastName>
    <FirstName>AYMANE&#xA0;</FirstName>
    <DateofBirth>03/12/2000</DateofBirth>
    <Phone>09 25 82 42 37</Phone>
    <Email>Nulla@nequeInornare.edu</Email>
  </student><student>
    <CNE>18010230</CNE>
    <LastName>DKHISSI&#xA0;</LastName>
    <FirstName>AYOUB</FirstName>
    <DateofBirth>19/07/1999</DateofBirth>
    <Phone>05 77 03 22 28</Phone>
    <Email>a.purus.Duis@semperauctorMauris.org</Email>
  </student><student>
    <CNE>18008842</CNE>
    <LastName>AMARA&#xA0;</LastName>
    <FirstName>ASMAE</FirstName>
    <DateofBirth>27/04/1996</DateofBirth>
    <Phone>09 31 60 34 93</Phone>
    <Email>primis@euismod.net</Email>
  </student><student>
    <CNE>18008829</CNE>
    <LastName>AOUAD&#xA0;</LastName>
    <FirstName>SAMI</FirstName>
    <DateofBirth>19/08/1998</DateofBirth>
    <Phone>02 41 34 61 92</Phone>
    <Email>eu.tellus.eu@urnaet.org</Email>
  </student><student>
    <CNE>17004775</CNE>
    <LastName>BAHID&#xA0;</LastName>
    <FirstName>RIHAB</FirstName>
    <DateofBirth>08/01/2001</DateofBirth>
    <Phone>01 51 56 04 75</Phone>
    <Email>Cras.interdum.Nunc@nec.net</Email>
  </student><student>
    <CNE>18008745</CNE>
    <LastName>BARRO&#xA0;</LastName>
    <FirstName>CHEICKNA</FirstName>
    <DateofBirth>18/03/1995</DateofBirth>
    <Phone>09 86 03 83 03</Phone>
    <Email>aliquam.eros.turpis@Maurisquisturpis.org</Email>
  </student><student>
    <CNE>16010196</CNE>
    <LastName>BEN TARKI&#xA0;</LastName>
    <FirstName>NOUHAILA</FirstName>
    <DateofBirth>01/02/2000</DateofBirth>
    <Phone>02 05 53 81 64</Phone>
    <Email>fringilla.cursus.purus@turpisnonenim.net</Email>
  </student><student>
    <CNE>17005920</CNE>
    <LastName>BENKHANOUS&#xA0;</LastName>
    <FirstName>SALAHEDDINE</FirstName>
    <DateofBirth>31/12/1998</DateofBirth>
    <Phone>03 60 13 08 48</Phone>
    <Email>pretium.et@Aeneanegestas.edu</Email>
  </student><student>
    <CNE>18008470</CNE>
    <LastName>BENTALEB&#xA0;</LastName>
    <FirstName>CHAYMAE</FirstName>
    <DateofBirth>15/01/2001</DateofBirth>
    <Phone>05 19 05 86 31</Phone>
    <Email>ornare.facilisis.eget@elit.ca</Email>
  </student><student>
    <CNE>18008836</CNE>
    <LastName>EL MOUTTAKI&#xA0;</LastName>
    <FirstName>ADNAN</FirstName>
    <DateofBirth>29/04/1998</DateofBirth>
    <Phone>01 75 51 34 37</Phone>
    <Email>ante@orci.net</Email>
  </student><student>
    <CNE>18008738</CNE>
    <LastName>EN-NABOUCH&#xA0;</LastName>
    <FirstName>MOHAMED</FirstName>
    <DateofBirth>09/04/1999</DateofBirth>
    <Phone>01 77 86 71 61</Phone>
    <Email>sodales.Mauris@mattis.ca</Email>
  </student><student>
    <CNE>18008643</CNE>
    <LastName>EN-NIARI&#xA0;</LastName>
    <FirstName>AMR</FirstName>
    <DateofBirth>20/02/1997</DateofBirth>
    <Phone>03 83 03 68 01</Phone>
    <Email>Integer.vitae@eutellusPhasellus.com</Email>
  </student></students>
