<?xml version="1.0"?>
<students xmlns:xsi="http://www.w3.org/2001/XMLSchema-instance" xsi:noNamespaceSchemaLocation="C://xampp/htdocs/Gestion_scolaire/fichiersDeValidation/students.xsd"><student>
    <CNE>72</CNE>
    <LastName>Grace</LastName>
    <FirstName>Jenman</FirstName>
    <DateofBirth>15/08/1996</DateofBirth>
    <Phone>595 506 9492</Phone>
    <Email>gjenmano@ow.ly</Email>
  </student><student>
    <CNE>73</CNE>
    <LastName>Horton</LastName>
    <FirstName>Fairy</FirstName>
    <DateofBirth>29/07/1995</DateofBirth>
    <Phone>972 281 4353</Phone>
    <Email>hfairyp@shareasale.com</Email>
  </student><student>
    <CNE>74</CNE>
    <LastName>Bobbie</LastName>
    <FirstName>Vian</FirstName>
    <DateofBirth>26/08/2000</DateofBirth>
    <Phone>763 369 4674</Phone>
    <Email>bvianq@icio.us</Email>
  </student><student>
    <CNE>75</CNE>
    <LastName>Minnaminnie</LastName>
    <FirstName>Kemmet</FirstName>
    <DateofBirth>05/04/1996</DateofBirth>
    <Phone>445 233 3401</Phone>
    <Email>mkemmetr@msn.com</Email>
  </student><student>
    <CNE>76</CNE>
    <LastName>Dianne</LastName>
    <FirstName>Pylkynyton</FirstName>
    <DateofBirth>17/03/1997</DateofBirth>
    <Phone>420 190 7904</Phone>
    <Email>dpylkynytons@aol.com</Email>
  </student><student>
    <CNE>77</CNE>
    <LastName>Myranda</LastName>
    <FirstName>Bartholomieu</FirstName>
    <DateofBirth>12/04/1997</DateofBirth>
    <Phone>545 540 0271</Phone>
    <Email>mbartholomieut@latimes.com</Email>
  </student><student>
    <CNE>78</CNE>
    <LastName>Jennine</LastName>
    <FirstName>Briance</FirstName>
    <DateofBirth>16/11/1998</DateofBirth>
    <Phone>875 773 9864</Phone>
    <Email>jbrianceu@adobe.com</Email>
  </student><student>
    <CNE>79</CNE>
    <LastName>Isahella</LastName>
    <FirstName>Gulleford</FirstName>
    <DateofBirth>09/08/2000</DateofBirth>
    <Phone>160 513 4609</Phone>
    <Email>igullefordv@51.la</Email>
  </student><student>
    <CNE>80</CNE>
    <LastName>Fowler</LastName>
    <FirstName>Cattanach</FirstName>
    <DateofBirth>17/06/1997</DateofBirth>
    <Phone>630 373 3262</Phone>
    <Email>fcattanachw@samsung.com</Email>
  </student><student>
    <CNE>81</CNE>
    <LastName>Gage</LastName>
    <FirstName>Marzelli</FirstName>
    <DateofBirth>26/03/1996</DateofBirth>
    <Phone>183 310 9735</Phone>
    <Email>gmarzellix@abc.net.au</Email>
  </student><student>
    <CNE>82</CNE>
    <LastName>Idalia</LastName>
    <FirstName>Titmarsh</FirstName>
    <DateofBirth>16/03/2000</DateofBirth>
    <Phone>788 750 9848</Phone>
    <Email>ititmarshy@thetimes.co.uk</Email>
  </student><student>
    <CNE>83</CNE>
    <LastName>Ham</LastName>
    <FirstName>Meni</FirstName>
    <DateofBirth>17/02/1995</DateofBirth>
    <Phone>205 272 6454</Phone>
    <Email>hmeniz@wp.com</Email>
  </student><student>
    <CNE>84</CNE>
    <LastName>Jess</LastName>
    <FirstName>Randalston</FirstName>
    <DateofBirth>20/03/1996</DateofBirth>
    <Phone>675 738 9968</Phone>
    <Email>jrandalston10@harvard.edu</Email>
  </student><student>
    <CNE>85</CNE>
    <LastName>Emelyne</LastName>
    <FirstName>Tinson</FirstName>
    <DateofBirth>18/06/1999</DateofBirth>
    <Phone>796 884 9163</Phone>
    <Email>etinson11@state.gov</Email>
  </student><student>
    <CNE>86</CNE>
    <LastName>Ynez</LastName>
    <FirstName>Rosengart</FirstName>
    <DateofBirth>27/05/1997</DateofBirth>
    <Phone>448 469 8624</Phone>
    <Email>yrosengart12@booking.com</Email>
  </student><student>
    <CNE>87</CNE>
    <LastName>Erminie</LastName>
    <FirstName>Wilbraham</FirstName>
    <DateofBirth>01/07/1996</DateofBirth>
    <Phone>239 780 5368</Phone>
    <Email>ewilbraham13@unicef.org</Email>
  </student><student>
    <CNE>88</CNE>
    <LastName>Gayler</LastName>
    <FirstName>Arbor</FirstName>
    <DateofBirth>11/11/1996</DateofBirth>
    <Phone>576 336 1450</Phone>
    <Email>garbor14@google.com.hk</Email>
  </student><student>
    <CNE>89</CNE>
    <LastName>Darcee</LastName>
    <FirstName>Sexton</FirstName>
    <DateofBirth>17/12/2000</DateofBirth>
    <Phone>996 218 4408</Phone>
    <Email>dsexton15@geocities.com</Email>
  </student><student>
    <CNE>90</CNE>
    <LastName>Stillmann</LastName>
    <FirstName>Androlli</FirstName>
    <DateofBirth>08/03/2000</DateofBirth>
    <Phone>476 650 4583</Phone>
    <Email>sandrolli16@exblog.jp</Email>
  </student><student>
    <CNE>91</CNE>
    <LastName>Tommy</LastName>
    <FirstName>Rolles</FirstName>
    <DateofBirth>13/02/1996</DateofBirth>
    <Phone>547 440 7861</Phone>
    <Email>trolles17@bloglovin.com</Email>
  </student><student>
    <CNE>92</CNE>
    <LastName>Bennie</LastName>
    <FirstName>Igoe</FirstName>
    <DateofBirth>03/03/1996</DateofBirth>
    <Phone>146 412 2917</Phone>
    <Email>bigoe18@youtu.be</Email>
  </student><student>
    <CNE>93</CNE>
    <LastName>Rosette</LastName>
    <FirstName>Bendall</FirstName>
    <DateofBirth>04/04/2000</DateofBirth>
    <Phone>361 209 9497</Phone>
    <Email>rbendall19@globo.com</Email>
  </student><student>
    <CNE>94</CNE>
    <LastName>Karin</LastName>
    <FirstName>Vasyaev</FirstName>
    <DateofBirth>28/05/1996</DateofBirth>
    <Phone>294 731 4140</Phone>
    <Email>kvasyaev1a@ft.com</Email>
  </student></students>
